{
  "$schema": "http://json-schema.org/draft-07/schema#",
  "$id": "https://claude.local/schemas/hooks.schema.json",
  "title": "Claude Plugin Hooks",
  "type": "object",
  "required": [
    "version",
    "plugin",
    "hooks"
  ],
  "properties": {
    "$schema": {
      "type": "string"
    },
    "version": {
      "type": "string",
      "minLength": 1
    },
    "plugin": {
      "type": "string",
      "minLength": 1
    },
    "description": {
      "type": "string"
    },
    "settings": {
      "type": "object",
      "additionalProperties": true
    },
    "metadata": {
      "type": "object",
      "additionalProperties": true
    },
    "hooks": {
      "type": "array",
      "items": {
        "type": "object",
        "required": [
          "event",
          "handlers"
        ],
        "properties": {
          "id": {
            "type": "string"
          },
          "name": {
            "type": "string"
          },
          "event": {
            "type": "string",
            "enum": [
              "SessionStart",
              "UserPromptSubmit",
              "PreToolUse",
              "PostToolUse",
              "Stop",
              "SessionEnd",
              "PreCompact",
              "TaskCompleted"
            ]
          },
          "description": {
            "type": "string"
          },
          "matcher": {
            "type": "string"
          },
          "trigger": {
            "type": "object",
            "additionalProperties": true
          },
          "handlers": {
            "type": "array",
            "items": {
              "type": "object",
              "required": [
                "type"
              ],
              "properties": {
                "type": {
                  "type": "string",
                  "minLength": 1
                }
              },
              "additionalProperties": true
            }
          },
          "metadata": {
            "type": "object",
            "additionalProperties": true
          }
        },
        "additionalProperties": true
      }
    }
  },
  "additionalProperties": true
}
