{
  "$schema": "../../../schemas/hooks.schema.json",
  "version": "2.0.0",
  "plugin": "ahling-command-center",
  "description": "Ahling Command Center deployment guard hooks",
  "hooks": [
    {
      "id": "acc-predeploy-check",
      "event": "PreToolUse",
      "severity": "warn",
      "description": "Validate ACC deployment prerequisites before shell execution.",
      "trigger": {
        "scope": "tool",
        "tools": [
          "Bash"
        ],
        "command_patterns": [
          "(docker|compose|deploy|kubernetes|kubectl)"
        ]
      },
      "handlers": [
        {
          "type": "prompt",
          "prompt": "Run ACC predeploy check for daemon/network/secrets/resources before command execution.",
          "doc_ref": "docs/hooks/prompt-guidance.md#ahling-command-center"
        }
      ]
    },
    {
      "id": "acc-postdeploy-check",
      "event": "PostToolUse",
      "severity": "advisory",
      "description": "Recommend post-deployment validation after ACC shell actions.",
      "trigger": {
        "scope": "tool",
        "tools": [
          "Bash"
        ],
        "command_patterns": [
          "(docker|compose|deploy|kubernetes|kubectl)"
        ]
      },
      "handlers": [
        {
          "type": "prompt",
          "prompt": "Run ACC postdeploy health/log/resource follow-up recommendations.",
          "doc_ref": "docs/hooks/prompt-guidance.md#ahling-command-center"
        }
      ]
    }
  ],
  "settings": {}
}
